Footwear Name,Footwear Brand,Price
Slipstream Unisex White Sneakers,Puma,"?9,999"
Men Solid Grey Sneakers,Red Tape,"?2,069"
Lars Black Sneakers,U.S. POLO ASSN.,"?3,010"
GO RUN GLIDE-STEP FLEX-RADAR White Running Shoes,SKECHERS,"?5,400"
Run Steady M Black Running Shoes,adidas,"?3,900"
Solid Dark Grey Flipflops,Carlton London,?750
Men White Venom Sneakers,FILA,"?6,999"
Navy Blue Flipflops,Louis Philippe,?850
Jaripeo HULBART Premium Vegan Synthetic Brown Casual Shoes for Men,BUCKAROO,"?2,275"
Camp-Ross White Men Running Shoes,Campus,"?2,599"
Toro Black Double Monk Straps Shoes,Alberto Torresi,"?2,169"
Karson Synthetic Black Textured Oxford Casual Shoes,Aldo,"?5,000"
Solid Black Sneakers,London Rag,"?1,800"
Earth M Beige Textured Men Sneakers,SOLETHREADS,"?1,800"
402 Tubing Low-Top White Blue Colorblock Sneakers,10-Jul,"?2,976"
Weapon Running and Jogging Shoe,Vector X,"?1,149"
Men Mesh Speedster Black Running Shoe,Cultsport,"?3,120"
Loafers for Men (Black),Bata,"?1,955"
Lebron 3.0 Blu Mens Textured Off White Sneakers,U.S. POLO ASSN.,"?2,365"
Smashic Unisex White Sneakers,Puma,"?2,469"
Textured Clogs Black Men,Carlton London,?850
Smashic Unisex Black Sneakers,Puma,"?2,469"
Dapper Off White Running Shoes For Men,Campus,?999
White Flipflops,Louis Philippe,"?1,100"
Men Textured White Walking Shoes,Red Tape,"?2,069"
Colorblock Navy Blue Sliders,Sandak,?522
Pictor M Grey Running Shoes,adidas,"?3,250"
Forum Low Rt Basics White Sneakers,adidas Originals,"?9,999"
GO RUN ELEVATE - NANDAYUS White Running Shoes,SKECHERS,"?4,900"
Iru Mud Dark Brown Men Solid Flats,Paaduks,"?1,647"
Purple Arizona Solid Narrow Width Sandals,Birkenstock,"?4,990"
Street Slip On for Men (Black),Hush Puppies,"?4,250"
Freeway Navy Colorblock Men Sliders,SOLETHREADS,?575
Animal Print Black Loafers,Truffle Collection,"?2,200"
Barcus Black Ankle Boots,Alberto Torresi,"?4,197"
Blue Marathon 2.0 Running Shoes for Men,Nivia,"?1,449"
Jaripeo HULBART Premium Vegan Synthetic Blue Casual Shoes for Men,BUCKAROO,"?2,275"
Solid Black Casual Shoes,Bata,"?2,125"
Bronel 3.0 White Sneakers,U.S. POLO ASSN.,"?2,150"
Cricket Square Mens White Cricket Shoes,Puma,"?3,499"
Solid Dark Grey Classic Sliders,Carlton London,?850
First White Running Shoes For Men,Campus,"?1,349"
Galaxy 5 New Black Running Shoes,adidas,"?2,800"
Men Textured Black Walking Shoes,Red Tape,"?2,069"
GO WALK 6 - BOLD KNIGHT White Walking Shoes,SKECHERS,"?4,200"
Graphic Blue Flip Flops,Louis Philippe,"?1,180"
Colorblock Grey Sliders,Sandak,?522
Black Arizona Cork Regular Width Flipflops,Birkenstock,"?4,990"
